title,combined_sentiment,score,date,joy,trust
$Hoge update 08.18.2021 Do not tell me I did not tell anyone about this Project,8.402739726027397,0,2021-08-18,29,44
"I researched Ergo [ERG], here's what I found (technical explainer)",5.792009132420091,66,2021-09-18,18,55
"QuickSwap Releases Dragons Syrup Pools, Launch Part For Next 30 Days!",5.4685692541856925,0,2021-08-21,18,31
"In February, I launched The Coin Perspective on this very subreddit. 6 months later, I want to share its progress so far, and plans for the future.",5.187595129375952,84,2021-09-01,14,26
"An NFT is more than just a jpeg, there part of the future of crypto...",5.173744292237443,25,2021-08-26,19,37
Where do you see cryptocurrency in 5 years according to you!,5.155631659056316,17,2021-08-22,13,26
A future day with IOTA,5.014992389649923,499,2021-08-14,19,32
Tezos: A Decentralized Roadmap,4.927701674277016,150,2021-09-18,22,54
Fastest Transacting Cryptos,4.916362252663622,17,2021-08-16,7,30
Algorand Mega Post (and more tokenomics discussion),4.851750380517504,196,2021-09-03,16,60
